[
  {
    "ticketKey": "NOVA-101",
    "title": "HTTP 409 Conflict: Duplicate synthetic resource ID during virtual circuit allocation",
    "service": "resource-inventory-service",
    "environment": "staging",
    "statusCode": 409,
    "scenarioType": "DUPLICATE_RESOURCE_ID",
    "isComplete": true,
    "readinessScore": 95.0,
    "reporterEmail": "demo-operator-01@northstar.example.com",
    "description": "Attempting to allocate virtual circuit DEMO-RESOURCE-1001 resulted in a 409 Conflict error. The database reports a primary key collision on synthetic resource identifier.",
    "apiDetails": "POST /api/v1/resources/allocate (Host: resource-inventory-service.internal.northstar.example.com:8084)",
    "logs": "2026-10-09T08:14:22.102Z [http-nio-8084-exec-3] WARN  c.n.inventory.service.ResourceAllocationService - [corrId=CORR-DEMO-1001, traceId=trace-demo-88102] Resource ID DEMO-RESOURCE-1001 already reserved for site SITE-NYC-01.\norg.springframework.dao.DataIntegrityViolationException: Pre-existing allocation detected for resource ID: DEMO-RESOURCE-1001\n\tat com.northstar.inventory.repository.JpaResourceRepository.save(JpaResourceRepository.java:94)\n\tat com.northstar.inventory.service.ResourceAllocationService.reserveCircuit(ResourceAllocationService.java:142)",
    "requestPayload": "{\"resourceType\": \"VIRTUAL_CIRCUIT\", \"siteId\": \"SITE-NYC-01\", \"requestedCapacityGbps\": 10, \"resourceId\": \"DEMO-RESOURCE-1001\"}",
    "responsePayload": "{\"error\": \"RESOURCE_ALREADY_EXISTS\", \"message\": \"Resource DEMO-RESOURCE-1001 already allocated\", \"status\": 409}",
    "errorMessage": "DataIntegrityViolationException: Pre-existing allocation detected for resource ID: DEMO-RESOURCE-1001",
    "expectedBehavior": "Resource allocation should either generate a distinct synthetic ID or return idempotency confirmation.",
    "actualBehavior": "Returns HTTP 409 and halts the workflow orchestrator pipeline.",
    "replicationSteps": "1. Post resource allocation payload with resourceId DEMO-RESOURCE-1001 to /api/v1/resources/allocate.\n2. Observe HTTP 409 Conflict.",
    "correlationId": "CORR-DEMO-1001",
    "probableRootCause": "Concurrency race condition or lack of deterministic UUID generation causing resourceId collision on retry.",
    "resolution": "Enable UUIDv4 random generator for synthetic resource allocation and implement optimistic locking."
  },
  {
    "ticketKey": "NOVA-102",
    "title": "HTTP 504 Gateway Timeout: Downstream timeout in workflow-orchestrator calling inventory",
    "service": "workflow-orchestrator",
    "environment": "production-simulation",
    "statusCode": 504,
    "scenarioType": "DOWNSTREAM_TIMEOUT",
    "isComplete": true,
    "readinessScore": 100.0,
    "reporterEmail": "demo-sre-02@northstar.example.com",
    "description": "Workflow execution WF-EXEC-5021 failed after 30 seconds waiting on resource-inventory-service. SAGA compensation triggered.",
    "apiDetails": "POST /api/v1/workflows/start (Host: workflow-orchestrator.internal.northstar.example.com:8082)",
    "logs": "2026-10-09T08:22:15.890Z [orchestrator-worker-4] ERROR c.n.workflow.engine.SagaStepExecutor - [corrId=CORR-DEMO-1002, traceId=trace-demo-99231] Step ALLOCATE_IP timed out after 30000ms calling http://resource-inventory-service:8084/api/v1/resources/allocate\njava.net.http.HttpTimeoutException: request timed out\n\tat com.northstar.workflow.client.InventoryClient.allocateResource(InventoryClient.java:78)\n\tat com.northstar.workflow.engine.SagaStepExecutor.executeStep(SagaStepExecutor.java:112)",
    "requestPayload": "{\"workflowType\": \"CIRCUIT_LIFECYCLE\", \"initiatorId\": \"REQ-DEMO-9001\", \"steps\": [\"VALIDATE\", \"ALLOCATE_IP\"]}",
    "responsePayload": "{\"error\": \"GATEWAY_TIMEOUT\", \"message\": \"Downstream inventory service did not reply within 30000ms\", \"status\": 504}",
    "errorMessage": "java.net.http.HttpTimeoutException: request timed out",
    "expectedBehavior": "Downstream call completes within 1500ms or fails fast with circuit breaker fallback.",
    "actualBehavior": "Blocks thread for 30 seconds before timing out.",
    "replicationSteps": "1. Trigger workflow WF-EXEC-5021 during peak simulated traffic.\n2. Observe 30s delay and 504 status.",
    "correlationId": "CORR-DEMO-1002",
    "probableRootCause": "Thread pool exhaustion on resource-inventory-service and missing Resilience4j timeout circuit breaker.",
    "resolution": "Set HTTP client connect/read timeout to 5000ms with Resilience4j circuit breaker fallback."
  },
  {
    "ticketKey": "NOVA-103",
    "title": "Circuit provisioning fails randomly",
    "service": "service-request-api",
    "environment": "staging",
    "statusCode": 500,
    "scenarioType": "INCOMPLETE_MISSING_LOGS",
    "isComplete": false,
    "readinessScore": 30.0,
    "reporterEmail": "demo-qa-03@northstar.example.com",
    "description": "I tried to create a circuit provisioning request and it gave me an error on the screen.",
    "apiDetails": "",
    "logs": "",
    "requestPayload": "",
    "responsePayload": "",
    "errorMessage": "Internal error occurred",
    "expectedBehavior": "Should succeed",
    "actualBehavior": "Got error",
    "replicationSteps": "Click submit",
    "correlationId": "",
    "probableRootCause": "",
    "resolution": ""
  },
  {
    "ticketKey": "NOVA-104",
    "title": "HTTP 401 Unauthorized: JWT token expired on integration-gateway ingress",
    "service": "integration-gateway",
    "environment": "staging",
    "statusCode": 401,
    "scenarioType": "AUTH_EXPIRED_TOKEN",
    "isComplete": true,
    "readinessScore": 90.0,
    "reporterEmail": "demo-dev-04@northstar.example.com",
    "description": "Integration gateway rejected request from partner portal with 401 Unauthorized. JWT validation claims token expired 120 seconds ago.",
    "apiDetails": "POST /api/v1/requests (Host: integration-gateway.internal.northstar.example.com:8087)",
    "logs": "2026-10-09T08:35:10.450Z [gateway-worker-1] WARN  c.n.gateway.security.JwtAuthenticationFilter - [corrId=CORR-DEMO-1004, traceId=trace-demo-10492] JWT claim 'exp' [1760000000] is before current clock [1760000120]. Token expired.\ncom.auth0.jwt.exceptions.TokenExpiredException: The Token has expired on 2026-10-09T08:33:10Z.",
    "requestPayload": "{\"customerId\": \"DEMO-CUST-8041\", \"requestType\": \"PROVISION_CIRCUIT\"}",
    "responsePayload": "{\"error\": \"UNAUTHORIZED\", \"message\": \"Security token has expired\", \"status\": 401}",
    "errorMessage": "com.auth0.jwt.exceptions.TokenExpiredException: The Token has expired",
    "expectedBehavior": "Integration gateway validates active token or returns token refresh prompt.",
    "actualBehavior": "401 Unauthorized returned to client.",
    "replicationSteps": "Send request with expired bearer token header Authorization: Bearer eyJhbGci...",
    "correlationId": "CORR-DEMO-1004",
    "probableRootCause": "Clock drift between edge gateway and auth issuer or client failure to refresh OAuth2 token.",
    "resolution": "Configure 30-second leeway in JWT verification and update client SDK to refresh tokens 5 minutes prior to expiry."
  },
  {
    "ticketKey": "NOVA-105",
    "title": "HTTP 400 Bad Request: Schema validation failed for negative bandwidth value",
    "service": "request-validation-engine",
    "environment": "development",
    "statusCode": 400,
    "scenarioType": "SCHEMA_VALIDATION_FAILURE",
    "isComplete": true,
    "readinessScore": 95.0,
    "reporterEmail": "demo-tester-05@northstar.example.com",
    "description": "The validation engine rejected order payload because bandwidthMbps was -50. Schema requires minimum 10.",
    "apiDetails": "POST /api/v1/validate (Host: request-validation-engine.internal.northstar.example.com:8083)",
    "logs": "2026-10-09T08:41:00.123Z [validation-exec-2] INFO  c.n.validation.engine.SchemaValidator - [corrId=CORR-DEMO-1005] Schema constraint violation: $.parameters.bandwidthMbps must be >= 10, found: -50",
    "requestPayload": "{\"entityType\": \"SERVICE_ORDER\", \"payload\": {\"bandwidthMbps\": -50, \"region\": \"us-east-zone-1\"}}",
    "responsePayload": "{\"valid\": false, \"errors\": [\"parameters.bandwidthMbps must be greater than or equal to 10\"]}",
    "errorMessage": "SchemaConstraintViolationException: bandwidthMbps must be >= 10",
    "expectedBehavior": "Reject with clean field-level error messages.",
    "actualBehavior": "HTTP 400 returned with validation error array.",
    "replicationSteps": "Submit POST to /api/v1/validate with bandwidthMbps = -50.",
    "correlationId": "CORR-DEMO-1005",
    "probableRootCause": "Client-side form missing input validation constraint before submission.",
    "resolution": "Add frontend min=10 boundary validation to bandwidth input field."
  },
  {
    "ticketKey": "NOVA-106",
    "title": "HTTP 429 Too Many Requests: Rate limit exceeded on partner-connect-api",
    "service": "partner-connect-api",
    "environment": "production-simulation",
    "statusCode": 429,
    "scenarioType": "RATE_LIMIT_EXCEEDED",
    "isComplete": true,
    "readinessScore": 90.0,
    "reporterEmail": "demo-dev-06@northstar.example.com",
    "description": "Carrier webhook sync flooded partner-connect-api with 350 requests/sec, exceeding token bucket limit of 100 req/sec.",
    "apiDetails": "POST /api/v1/partner/sync (Host: partner-connect-api.internal.northstar.example.com:8089)",
    "logs": "2026-10-09T08:50:33.200Z [rate-limiter-1] WARN  c.n.partner.interceptor.RateLimitInterceptor - [corrId=CORR-DEMO-1006] Client PARTNER-CARRIER-01 exceeded rate limit quota (100 req/s). Current: 352 req/s",
    "requestPayload": "{\"partnerId\": \"PARTNER-CARRIER-01\", \"batchSize\": 500}",
    "responsePayload": "{\"error\": \"TOO_MANY_REQUESTS\", \"retryAfterSeconds\": 15, \"status\": 429}",
    "errorMessage": "RateLimitExceededException: Quota exceeded for client PARTNER-CARRIER-01",